{
  "id": "DECK-STARTER-E-001",
  "name": "Blaze-Grove (EINFACH)",
  "format": "EINFACH",
  "version": "1.0",
  "cards": [
    { "card_id": "CARD-SET-001-001", "count": 3 },
    { "card_id": "CARD-SET-001-003", "count": 3 },
    { "card_id": "CARD-SET-001-004", "count": 2 },
    { "card_id": "CARD-SET-001-005", "count": 2 },

    { "card_id": "CARD-SET-001-014", "count": 3 },
    { "card_id": "CARD-SET-001-012", "count": 3 },
    { "card_id": "CARD-SET-001-015", "count": 2 },
    { "card_id": "CARD-SET-001-016", "count": 2 },

    { "card_id": "ENERGY_FIRE", "count": 5 },
    { "card_id": "ENERGY_NATURE", "count": 5 }
  ],
  "notes": "Aggro/Midrange Starter. Fokus: Fire + Nature. Minis: Burn + Draw/Support."
}
